{
  "$schema": "https://json-schema.org/draft/2020-12/schema",
  "$id": "urn:agentj:design:p86:preflight:1",
  "title": "preflight proposed design",
  "type": "object",
  "additionalProperties": false,
  "properties": {
    "schema_version": {
      "const": 1
    },
    "card_id": {
      "type": "string",
      "pattern": "^[a-z0-9][a-z0-9.-]{0,79}$"
    },
    "task_id": {
      "type": "string",
      "pattern": "^[a-z0-9][a-z0-9.-]{0,79}$"
    },
    "revision": {
      "type": "integer",
      "minimum": 1
    },
    "brief_digest": {
      "type": "string",
      "pattern": "^[a-f0-9]{64}$"
    },
    "registry_revision": {
      "type": "integer",
      "minimum": 1
    },
    "nonce": {
      "type": "string",
      "minLength": 16,
      "maxLength": 128
    },
    "expires_at": {
      "type": "string",
      "format": "date-time",
      "pattern": "^[0-9]{4}-[0-9]{2}-[0-9]{2}T[0-9]{2}:[0-9]{2}:[0-9]{2}(?:\\.[0-9]+)?(?:Z|[+-][0-9]{2}:[0-9]{2})$"
    },
    "status": {
      "enum": [
        "collecting",
        "needs_input",
        "verifying",
        "ready",
        "dispatched",
        "cancelled",
        "expired",
        "blocked"
      ]
    },
    "required": {
      "type": "array",
      "items": {
        "type": "object",
        "additionalProperties": false,
        "properties": {
          "id": {
            "type": "string",
            "pattern": "^[a-z0-9][a-z0-9.-]{0,79}$"
          },
          "capability_id": {
            "type": "string",
            "pattern": "^[a-z0-9][a-z0-9.-]{0,79}$"
          },
          "why": {
            "type": "object",
            "additionalProperties": false,
            "properties": {
              "zh": {
                "type": "string",
                "minLength": 1,
                "maxLength": 500
              },
              "en": {
                "type": "string",
                "minLength": 1,
                "maxLength": 500
              }
            },
            "required": [
              "zh",
              "en"
            ]
          },
          "how": {
            "type": "object",
            "additionalProperties": false,
            "properties": {
              "zh": {
                "type": "string",
                "minLength": 1,
                "maxLength": 500
              },
              "en": {
                "type": "string",
                "minLength": 1,
                "maxLength": 500
              }
            },
            "required": [
              "zh",
              "en"
            ]
          },
          "reuse": {
            "type": "object",
            "additionalProperties": false,
            "properties": {
              "zh": {
                "type": "string",
                "minLength": 1,
                "maxLength": 500
              },
              "en": {
                "type": "string",
                "minLength": 1,
                "maxLength": 500
              }
            },
            "required": [
              "zh",
              "en"
            ]
          },
          "status": {
            "enum": [
              "missing",
              "unverified",
              "verifying",
              "ready",
              "failed"
            ]
          },
          "action_kind": {
            "enum": [
              "choose",
              "login",
              "secret_card",
              "verify"
            ]
          }
        },
        "required": [
          "id",
          "capability_id",
          "why",
          "how",
          "reuse",
          "status",
          "action_kind"
        ]
      },
      "minItems": 0,
      "maxItems": 5
    },
    "optional": {
      "type": "array",
      "items": {
        "type": "object",
        "additionalProperties": false,
        "properties": {
          "id": {
            "type": "string",
            "pattern": "^[a-z0-9][a-z0-9.-]{0,79}$"
          },
          "capability_id": {
            "type": "string",
            "pattern": "^[a-z0-9][a-z0-9.-]{0,79}$"
          },
          "why": {
            "type": "object",
            "additionalProperties": false,
            "properties": {
              "zh": {
                "type": "string",
                "minLength": 1,
                "maxLength": 500
              },
              "en": {
                "type": "string",
                "minLength": 1,
                "maxLength": 500
              }
            },
            "required": [
              "zh",
              "en"
            ]
          },
          "how": {
            "type": "object",
            "additionalProperties": false,
            "properties": {
              "zh": {
                "type": "string",
                "minLength": 1,
                "maxLength": 500
              },
              "en": {
                "type": "string",
                "minLength": 1,
                "maxLength": 500
              }
            },
            "required": [
              "zh",
              "en"
            ]
          },
          "reuse": {
            "type": "object",
            "additionalProperties": false,
            "properties": {
              "zh": {
                "type": "string",
                "minLength": 1,
                "maxLength": 500
              },
              "en": {
                "type": "string",
                "minLength": 1,
                "maxLength": 500
              }
            },
            "required": [
              "zh",
              "en"
            ]
          },
          "status": {
            "enum": [
              "missing",
              "unverified",
              "verifying",
              "ready",
              "failed"
            ]
          },
          "action_kind": {
            "enum": [
              "choose",
              "login",
              "secret_card",
              "verify"
            ]
          }
        },
        "required": [
          "id",
          "capability_id",
          "why",
          "how",
          "reuse",
          "status",
          "action_kind"
        ]
      },
      "minItems": 0,
      "maxItems": 20
    }
  },
  "required": [
    "schema_version",
    "card_id",
    "task_id",
    "revision",
    "brief_digest",
    "registry_revision",
    "nonce",
    "expires_at",
    "status",
    "required",
    "optional"
  ],
  "allOf": [
    {
      "if": {
        "properties": {
          "status": {
            "enum": [
              "ready",
              "dispatched"
            ]
          }
        }
      },
      "then": {
        "properties": {
          "required": {
            "items": {
              "properties": {
                "status": {
                  "const": "ready"
                }
              }
            }
          }
        }
      }
    }
  ]
}
